{
  "schemaVersion": 1,
  "code": "STD-QC-BUG",
  "name": "Quản lý lỗi & Vòng đời Defect",
  "category": "11_quality_assurance_testing",
  "description": "Phân loại, tái hiện, xử lý và xác minh lỗi.",
  "version": "1.0.0",
  "status": "active",
  "rules": [
    {
      "title": "Defect phải ghi expected/actual, bước tái hiện, môi trường, phiên bản và bằng chứng",
      "detail": "Defect phải ghi expected/actual, bước tái hiện, môi trường, phiên bản và bằng chứng. Bằng chứng tối thiểu: tài liệu hoặc kết quả kiểm tra thể hiện việc áp dụng, người chịu trách nhiệm và ngoại lệ nếu có.",
      "layer": "process",
      "severity": "must",
      "example_good": "Có bằng chứng đối chiếu và kết quả rõ ràng: Defect phải ghi expected/actual, bước tái hiện, môi trường, phiên bản và bằng chứng.",
      "example_bad": "Không có bước kiểm tra hoặc bằng chứng cho yêu cầu: Defect phải ghi expected/actual, bước tái hiện, môi trường, phiên bản và bằng chứng."
    },
    {
      "title": "Phân biệt severity (mức tác động) với priority (thứ tự xử lý)",
      "detail": "Phân biệt severity (mức tác động) với priority (thứ tự xử lý). Bằng chứng tối thiểu: tài liệu hoặc kết quả kiểm tra thể hiện việc áp dụng, người chịu trách nhiệm và ngoại lệ nếu có.",
      "layer": "process",
      "severity": "must",
      "example_good": "Có bằng chứng đối chiếu và kết quả rõ ràng: Phân biệt severity (mức tác động) với priority (thứ tự xử lý).",
      "example_bad": "Không có bước kiểm tra hoặc bằng chứng cho yêu cầu: Phân biệt severity (mức tác động) với priority (thứ tự xử lý)."
    },
    {
      "title": "Theo dõi trạng thái New, Triaged, In Progress, Ready for Retest, Closed hoặc Reopened theo workflow dự án",
      "detail": "Theo dõi trạng thái New, Triaged, In Progress, Ready for Retest, Closed hoặc Reopened theo workflow dự án. Bằng chứng tối thiểu: tài liệu hoặc kết quả kiểm tra thể hiện việc áp dụng, người chịu trách nhiệm và ngoại lệ nếu có.",
      "layer": "process",
      "severity": "should",
      "example_good": "Có bằng chứng đối chiếu và kết quả rõ ràng: Theo dõi trạng thái New, Triaged, In Progress, Ready for Retest, Closed hoặc Reopened theo workflow dự án.",
      "example_bad": "Không có bước kiểm tra hoặc bằng chứng cho yêu cầu: Theo dõi trạng thái New, Triaged, In Progress, Ready for Retest, Closed hoặc Reopened theo workflow dự án."
    },
    {
      "title": "Kiểm tra lại bug fix và thực hiện regression vùng liên quan trước khi đóng",
      "detail": "Kiểm tra lại bug fix và thực hiện regression vùng liên quan trước khi đóng. Bằng chứng tối thiểu: tài liệu hoặc kết quả kiểm tra thể hiện việc áp dụng, người chịu trách nhiệm và ngoại lệ nếu có.",
      "layer": "process",
      "severity": "should",
      "example_good": "Có bằng chứng đối chiếu và kết quả rõ ràng: Kiểm tra lại bug fix và thực hiện regression vùng liên quan trước khi đóng.",
      "example_bad": "Không có bước kiểm tra hoặc bằng chứng cho yêu cầu: Kiểm tra lại bug fix và thực hiện regression vùng liên quan trước khi đóng."
    }
  ],
  "depends_on": [
    {
      "code": "STD-ERR",
      "dependency_type": "uses"
    },
    {
      "code": "STD-QC-EXEC",
      "dependency_type": "uses"
    },
    {
      "code": "STD-QC-REG",
      "dependency_type": "uses"
    }
  ],
  "integration_guide": [
    {
      "step": 1,
      "title": "Đánh giá phạm vi và rủi ro",
      "description": "Đối chiếu quản lý lỗi & vòng đời defect với requirement, các luồng và độ ưu tiên kiểm thử."
    },
    {
      "step": 2,
      "title": "Triển khai và thu thập bằng chứng",
      "description": "Chuẩn bị checklist, testcase hoặc automation phù hợp; chỉ định trách nhiệm và ghi lại bằng chứng."
    },
    {
      "step": 3,
      "title": "Xác nhận và cập nhật",
      "description": "Review kết quả, ghi nhận defect/ngoại lệ và đồng bộ traceability trước khi qua quality gate."
    }
  ],
  "common_issues": [
    {
      "issue": "Thiếu bằng chứng hoặc phạm vi chưa rõ",
      "cause": "Không liên kết requirement, testcase và người chịu trách nhiệm.",
      "solution": "Thiết lập liên kết, xác định phạm vi áp dụng và yêu cầu bằng chứng trước khi hoàn tất."
    }
  ]
}
