{
  "schemaVersion": 1,
  "code": "STD-CODE-REVIEW",
  "name": "Code Review & Quản trị Pull Request",
  "category": "01_governance_delivery",
  "description": "Tiêu chuẩn chuẩn hóa cho Code Review & Quản trị Pull Request. Xác định các quy tắc nền tảng, kỳ vọng review và hướng dẫn áp dụng cho các project thuộc phạm vi tiêu chuẩn này.",
  "version": "1.0.0",
  "status": "active",
  "rules": [
    {
      "title": "Xác định rõ cách tiếp cận cho Code Review & quản trị Pull Request trước khi triển khai",
      "detail": "Tài liệu hóa phạm vi, quyết định, ràng buộc và ownership cho Code Review & Quản trị Pull Request; liên kết quyết định với requirement liên quan và bằng chứng triển khai.",
      "layer": "process",
      "severity": "must",
      "example_good": "Project ghi nhận rõ cách Code Review & Quản trị Pull Request được áp dụng, ai chịu trách nhiệm và cách xác minh tuân thủ.",
      "example_bad": "Code Review & Quản trị Pull Request được triển khai theo kiểu ad hoc, không có quy tắc được tài liệu hóa hoặc bằng chứng review."
    },
    {
      "title": "Xử lý rõ ràng các trường hợp lỗi, biên và tương thích",
      "detail": "Xác định các failure mode liên quan, edge case, ràng buộc tương thích và kỳ vọng rollback/recovery trước khi release.",
      "layer": "process",
      "severity": "should",
      "example_good": "Các trường hợp biên và lỗi được thể hiện trong acceptance criteria, test, kiểm tra hoặc hướng dẫn vận hành.",
      "example_bad": "Chỉ happy path được xác định, còn các trường hợp lỗi bị để cho người triển khai tự suy đoán."
    },
    {
      "title": "Xác minh việc áp dụng bằng bằng chứng có thể lặp lại",
      "detail": "Sử dụng kiểm tra tự động khi khả thi và review thủ công khi cần đánh giá; ghi nhận các sai lệch có lý do thay vì âm thầm bỏ qua quy tắc.",
      "layer": "process",
      "severity": "should",
      "example_good": "Bằng chứng review hoặc kiểm tra tự động cho biết các quy tắc đã được kiểm tra và các ngoại lệ đã được phê duyệt.",
      "example_bad": "Standard chỉ tồn tại dưới dạng tài liệu nhưng không được tham chiếu trong quá trình delivery hoặc review."
    }
  ],
  "integration_guide": [
    {
      "step": 1,
      "title": "Đánh giá phạm vi áp dụng",
      "description": "Kiểm tra nền tảng project, requirement, kiến trúc và các điều kiện áp dụng của Code Review & Quản trị Pull Request; ghi nhận trường hợp loại trừ và override đã được phê duyệt."
    },
    {
      "step": 2,
      "title": "Áp dụng quy tắc",
      "description": "Đưa các quy tắc Code Review & Quản trị Pull Request áp dụng vào requirement, thiết kế, triển khai và checklist review; liên kết requirement và code liên quan khi phù hợp."
    },
    {
      "step": 3,
      "title": "Xác minh tuân thủ",
      "description": "Review bằng chứng, chạy các kiểm tra tự động/thủ công liên quan, ghi nhận lỗi, ngoại lệ được phê duyệt và công việc theo dõi trước khi hoàn tất."
    }
  ],
  "common_issues": [
    {
      "issue": "Áp dụng Code Review & Quản trị Pull Request không nhất quán",
      "cause": "Project profile chưa tham chiếu rõ standard/capability áp dụng hoặc chưa chỉ định owner.",
      "solution": "Tham chiếu rõ STD-CODE-REVIEW trong project profile, chỉ định owner và kiểm tra tuân thủ trước khi phê duyệt thay đổi."
    },
    {
      "issue": "Quy tắc đã được tài liệu hóa nhưng chưa có cơ chế xác minh",
      "cause": "Chưa có test, lint, checklist, bằng chứng review hoặc kiểm tra vận hành gắn với quy tắc.",
      "solution": "Gắn từng quy tắc quan trọng với bằng chứng xác minh thực tế và ghi nhận rõ các ngoại lệ."
    }
  ],
  "depends_on": [
    {
      "code": "STD-GIT",
      "dependency_type": "uses"
    },
    {
      "code": "STD-TEST",
      "dependency_type": "uses"
    },
    {
      "code": "STD-SEC",
      "dependency_type": "uses"
    }
  ],
  "diagrams": []
}
