{
  "schemaVersion": 1,
  "code": "STD-FL-BLOC",
  "name": "Flutter BLoC / Cubit",
  "category": "flutter",
  "description": "Flutter state management standard",
  "version": "1.0.0",
  "status": "active",
  "rules": [
    {
      "title": "Use BLoC/Cubit for feature state and explicit state transitions",
      "detail": "Use BLoC/Cubit for feature state and explicit state transitions. Verification: inspect the relevant requirement, implementation or automated check; record evidence for compliance and explain justified deviations.",
      "layer": "process",
      "severity": "must",
      "example_good": "Implementation/review evidence explicitly demonstrates: use bloc/cubit for feature state and explicit state transitions.",
      "example_bad": "An affected change ignores this rule without review or documented exception."
    },
    {
      "title": "Widgets render state and dispatch intentions; they do not call Dio directly",
      "detail": "Widgets render state and dispatch intentions; they do not call Dio directly. Verification: inspect the relevant requirement, implementation or automated check; record evidence for compliance and explain justified deviations.",
      "layer": "process",
      "severity": "must",
      "example_good": "Implementation/review evidence explicitly demonstrates: widgets render state and dispatch intentions; they do not call dio directly.",
      "example_bad": "An affected change ignores this rule without review or documented exception."
    },
    {
      "title": "Test success, loading, empty, validation and failure states",
      "detail": "Test success, loading, empty, validation and failure states. Verification: inspect the relevant requirement, implementation or automated check; record evidence for compliance and explain justified deviations.",
      "layer": "process",
      "severity": "should",
      "example_good": "Implementation/review evidence explicitly demonstrates: test success, loading, empty, validation and failure states.",
      "example_bad": "An affected change ignores this rule without review or documented exception."
    },
    {
      "title": "Close streams/subscriptions and prevent emissions after disposal",
      "detail": "Close streams/subscriptions and prevent emissions after disposal. Verification: inspect the relevant requirement, implementation or automated check; record evidence for compliance and explain justified deviations.",
      "layer": "process",
      "severity": "should",
      "example_good": "Implementation/review evidence explicitly demonstrates: close streams/subscriptions and prevent emissions after disposal.",
      "example_bad": "An affected change ignores this rule without review or documented exception."
    }
  ],
  "integration_guide": [
    {
      "step": 1,
      "title": "Assess applicability",
      "description": "Check project platform, requirements, architecture and applicable conditions for Flutter BLoC / Cubit; record exclusions and approved overrides."
    },
    {
      "step": 2,
      "title": "Apply rules",
      "description": "Include applicable Flutter BLoC / Cubit rules in design, implementation and review checklist; link relevant requirement and code."
    },
    {
      "step": 3,
      "title": "Verify compliance",
      "description": "Review evidence, run relevant automated checks, record failures and follow-up work before completion."
    }
  ],
  "common_issues": [
    {
      "issue": "Inconsistent adoption of Flutter BLoC / Cubit",
      "cause": "Project profile does not explicitly reference the standard or its owner.",
      "solution": "Attach standard by code to project profile, assign owner and check compliance before change approval."
    },
    {
      "issue": "Written standard is not enforceable automatically",
      "cause": "Some behaviour depends on design decisions and runtime context.",
      "solution": "Pair automated lint/tests with manual review and recorded acceptance evidence."
    }
  ],
  "depends_on": [
    {
      "code": "STD-REQ",
      "dependency_type": "requires"
    },
    {
      "code": "STD-TEST",
      "dependency_type": "requires"
    },
    {
      "code": "STD-MOB-ARCH",
      "dependency_type": "requires"
    }
  ]
}
