{
  "schemaVersion": 1,
  "code": "STD-MOB-NAV",
  "name": "Mobile Navigation & Deep Linking",
  "category": "mobile-platform",
  "description": "Navigation graph and links",
  "version": "1.0.0",
  "status": "active",
  "rules": [
    {
      "title": "Define typed route arguments and authentication/navigation guards",
      "detail": "Define typed route arguments and authentication/navigation guards. Verification: inspect the relevant requirement, implementation or automated check; record evidence for compliance and explain justified deviations.",
      "layer": "process",
      "severity": "must",
      "example_good": "Implementation/review evidence explicitly demonstrates: define typed route arguments and authentication/navigation guards.",
      "example_bad": "An affected change ignores this rule without review or documented exception."
    },
    {
      "title": "Support initial links, resumed-app links and invalid/expired destinations",
      "detail": "Support initial links, resumed-app links and invalid/expired destinations. Verification: inspect the relevant requirement, implementation or automated check; record evidence for compliance and explain justified deviations.",
      "layer": "process",
      "severity": "must",
      "example_good": "Implementation/review evidence explicitly demonstrates: support initial links, resumed-app links and invalid/expired destinations.",
      "example_bad": "An affected change ignores this rule without review or documented exception."
    },
    {
      "title": "Verify Android App Links and iOS Universal Links with domain association files",
      "detail": "Verify Android App Links and iOS Universal Links with domain association files. Verification: inspect the relevant requirement, implementation or automated check; record evidence for compliance and explain justified deviations.",
      "layer": "process",
      "severity": "should",
      "example_good": "Implementation/review evidence explicitly demonstrates: verify android app links and ios universal links with domain association files.",
      "example_bad": "An affected change ignores this rule without review or documented exception."
    },
    {
      "title": "Prevent duplicate navigation from competing notification/link callbacks",
      "detail": "Prevent duplicate navigation from competing notification/link callbacks. Verification: inspect the relevant requirement, implementation or automated check; record evidence for compliance and explain justified deviations.",
      "layer": "process",
      "severity": "should",
      "example_good": "Implementation/review evidence explicitly demonstrates: prevent duplicate navigation from competing notification/link callbacks.",
      "example_bad": "An affected change ignores this rule without review or documented exception."
    }
  ],
  "integration_guide": [
    {
      "step": 1,
      "title": "Assess applicability",
      "description": "Check project platform, requirements, architecture and applicable conditions for Mobile Navigation & Deep Linking; record exclusions and approved overrides."
    },
    {
      "step": 2,
      "title": "Apply rules",
      "description": "Include applicable Mobile Navigation & Deep Linking rules in design, implementation and review checklist; link relevant requirement and code."
    },
    {
      "step": 3,
      "title": "Verify compliance",
      "description": "Review evidence, run relevant automated checks, record failures and follow-up work before completion."
    }
  ],
  "common_issues": [
    {
      "issue": "Inconsistent adoption of Mobile Navigation & Deep Linking",
      "cause": "Project profile does not explicitly reference the standard or its owner.",
      "solution": "Attach standard by code to project profile, assign owner and check compliance before change approval."
    },
    {
      "issue": "Written standard is not enforceable automatically",
      "cause": "Some behaviour depends on design decisions and runtime context.",
      "solution": "Pair automated lint/tests with manual review and recorded acceptance evidence."
    }
  ],
  "depends_on": [
    {
      "code": "STD-REQ",
      "dependency_type": "requires"
    },
    {
      "code": "STD-TEST",
      "dependency_type": "requires"
    }
  ]
}
