{
  "schemaVersion": 1,
  "code": "STD-WEB-ARCH",
  "name": "Web Application Architecture",
  "category": "web-platform",
  "description": "Client boundaries and web modularity",
  "version": "1.0.0",
  "status": "active",
  "rules": [
    {
      "title": "Separate routes/pages, features, shared components and infrastructure adapters",
      "detail": "Separate routes/pages, features, shared components and infrastructure adapters. Verification: inspect the relevant requirement, implementation or automated check; record evidence for compliance and explain justified deviations.",
      "layer": "process",
      "severity": "must",
      "example_good": "Implementation/review evidence explicitly demonstrates: separate routes/pages, features, shared components and infrastructure adapters.",
      "example_bad": "An affected change ignores this rule without review or documented exception."
    },
    {
      "title": "Keep business rules out of rendering and browser event handlers",
      "detail": "Keep business rules out of rendering and browser event handlers. Verification: inspect the relevant requirement, implementation or automated check; record evidence for compliance and explain justified deviations.",
      "layer": "process",
      "severity": "must",
      "example_good": "Implementation/review evidence explicitly demonstrates: keep business rules out of rendering and browser event handlers.",
      "example_bad": "An affected change ignores this rule without review or documented exception."
    },
    {
      "title": "Define browser/server trust boundaries and API contract ownership",
      "detail": "Define browser/server trust boundaries and API contract ownership. Verification: inspect the relevant requirement, implementation or automated check; record evidence for compliance and explain justified deviations.",
      "layer": "process",
      "severity": "should",
      "example_good": "Implementation/review evidence explicitly demonstrates: define browser/server trust boundaries and api contract ownership.",
      "example_bad": "An affected change ignores this rule without review or documented exception."
    },
    {
      "title": "Avoid circular feature dependencies and unbounded shared utility modules",
      "detail": "Avoid circular feature dependencies and unbounded shared utility modules. Verification: inspect the relevant requirement, implementation or automated check; record evidence for compliance and explain justified deviations.",
      "layer": "process",
      "severity": "should",
      "example_good": "Implementation/review evidence explicitly demonstrates: avoid circular feature dependencies and unbounded shared utility modules.",
      "example_bad": "An affected change ignores this rule without review or documented exception."
    }
  ],
  "integration_guide": [
    {
      "step": 1,
      "title": "Assess applicability",
      "description": "Check project platform, requirements, architecture and applicable conditions for Web Application Architecture; record exclusions and approved overrides."
    },
    {
      "step": 2,
      "title": "Apply rules",
      "description": "Include applicable Web Application Architecture rules in design, implementation and review checklist; link relevant requirement and code."
    },
    {
      "step": 3,
      "title": "Verify compliance",
      "description": "Review evidence, run relevant automated checks, record failures and follow-up work before completion."
    }
  ],
  "common_issues": [
    {
      "issue": "Inconsistent adoption of Web Application Architecture",
      "cause": "Project profile does not explicitly reference the standard or its owner.",
      "solution": "Attach standard by code to project profile, assign owner and check compliance before change approval."
    },
    {
      "issue": "Written standard is not enforceable automatically",
      "cause": "Some behaviour depends on design decisions and runtime context.",
      "solution": "Pair automated lint/tests with manual review and recorded acceptance evidence."
    }
  ],
  "diagrams": [
    {
      "title": "Web Application Architecture - adoption flow",
      "type": "flow",
      "content": "flowchart TD\n  A[Receive requirement] --> B[Resolve applicable standards]\n  B --> C[Design and implementation]\n  C --> D[Validation and review]\n  D --> E[Record evidence]"
    }
  ],
  "depends_on": [
    {
      "code": "STD-REQ",
      "dependency_type": "requires"
    },
    {
      "code": "STD-TEST",
      "dependency_type": "requires"
    }
  ]
}
