{
  "schemaVersion": 1,
  "code": "STD-AUDIT",
  "name": "Audit Trail Feature",
  "category": "feature",
  "description": "Immutable business action evidence",
  "version": "1.0.0",
  "status": "active",
  "rules": [
    {
      "title": "Record actor, action, target, outcome and correlation ID",
      "detail": "Record actor, action, target, outcome and correlation ID. Verification: inspect the relevant requirement, implementation or automated check; record evidence for compliance and explain justified deviations.",
      "layer": "process",
      "severity": "must",
      "example_good": "Implementation/review evidence explicitly demonstrates: record actor, action, target, outcome and correlation id.",
      "example_bad": "An affected change ignores this rule without review or documented exception."
    },
    {
      "title": "Keep audit logs protected from ordinary user modification",
      "detail": "Keep audit logs protected from ordinary user modification. Verification: inspect the relevant requirement, implementation or automated check; record evidence for compliance and explain justified deviations.",
      "layer": "process",
      "severity": "must",
      "example_good": "Implementation/review evidence explicitly demonstrates: keep audit logs protected from ordinary user modification.",
      "example_bad": "An affected change ignores this rule without review or documented exception."
    },
    {
      "title": "Mask secret fields and enforce retention and access policy",
      "detail": "Mask secret fields and enforce retention and access policy. Verification: inspect the relevant requirement, implementation or automated check; record evidence for compliance and explain justified deviations.",
      "layer": "process",
      "severity": "should",
      "example_good": "Implementation/review evidence explicitly demonstrates: mask secret fields and enforce retention and access policy.",
      "example_bad": "An affected change ignores this rule without review or documented exception."
    },
    {
      "title": "Ensure business operations and audit event emission remain consistent",
      "detail": "Ensure business operations and audit event emission remain consistent. Verification: inspect the relevant requirement, implementation or automated check; record evidence for compliance and explain justified deviations.",
      "layer": "process",
      "severity": "should",
      "example_good": "Implementation/review evidence explicitly demonstrates: ensure business operations and audit event emission remain consistent.",
      "example_bad": "An affected change ignores this rule without review or documented exception."
    }
  ],
  "integration_guide": [
    {
      "step": 1,
      "title": "Assess applicability",
      "description": "Check project platform, requirements, architecture and applicable conditions for Audit Trail Feature; record exclusions and approved overrides."
    },
    {
      "step": 2,
      "title": "Apply rules",
      "description": "Include applicable Audit Trail Feature rules in design, implementation and review checklist; link relevant requirement and code."
    },
    {
      "step": 3,
      "title": "Verify compliance",
      "description": "Review evidence, run relevant automated checks, record failures and follow-up work before completion."
    }
  ],
  "common_issues": [
    {
      "issue": "Inconsistent adoption of Audit Trail Feature",
      "cause": "Project profile does not explicitly reference the standard or its owner.",
      "solution": "Attach standard by code to project profile, assign owner and check compliance before change approval."
    },
    {
      "issue": "Written standard is not enforceable automatically",
      "cause": "Some behaviour depends on design decisions and runtime context.",
      "solution": "Pair automated lint/tests with manual review and recorded acceptance evidence."
    }
  ],
  "features": [
    {
      "name": "Audit Trail Feature",
      "description": "Immutable business action evidence"
    }
  ],
  "user_stories": [
    {
      "title": "Use Audit Trail Feature",
      "as_a": "authorized application user",
      "i_want": "immutable business action evidence",
      "so_that": "I can complete the intended task safely and predictably",
      "acceptance_criteria": [
        {
          "given": "the user is eligible to access Audit Trail Feature",
          "when": "the user performs the main supported action",
          "then": "the system returns an authorized, validated outcome and communicates its state"
        },
        {
          "given": "an input, permission or dependency is invalid",
          "when": "the user attempts the action",
          "then": "the system blocks unsafe completion and shows a recoverable, non-sensitive error"
        }
      ],
      "related_rules": [
        "Record actor, action, target, outcome and correlation ID"
      ]
    }
  ],
  "depends_on": [
    {
      "code": "STD-REQ",
      "dependency_type": "requires"
    },
    {
      "code": "STD-TEST",
      "dependency_type": "requires"
    },
    {
      "code": "STD-FEAT",
      "dependency_type": "requires"
    },
    {
      "code": "STD-BIZ",
      "dependency_type": "requires"
    }
  ]
}
