{
  "schemaVersion": 1,
  "code": "STD-WEB-ROUTE",
  "name": "Browser Routing & URL State",
  "category": "web-platform",
  "description": "URL-driven navigation and access",
  "version": "1.0.0",
  "status": "active",
  "rules": [
    {
      "title": "Define canonical routes, parameters and missing-route behaviour",
      "detail": "Define canonical routes, parameters and missing-route behaviour. Verification: inspect the relevant requirement, implementation or automated check; record evidence for compliance and explain justified deviations.",
      "layer": "process",
      "severity": "must",
      "example_good": "Implementation/review evidence explicitly demonstrates: define canonical routes, parameters and missing-route behaviour.",
      "example_bad": "An affected change ignores this rule without review or documented exception."
    },
    {
      "title": "Preserve navigable filter/query state in the URL when shareable",
      "detail": "Preserve navigable filter/query state in the URL when shareable. Verification: inspect the relevant requirement, implementation or automated check; record evidence for compliance and explain justified deviations.",
      "layer": "process",
      "severity": "must",
      "example_good": "Implementation/review evidence explicitly demonstrates: preserve navigable filter/query state in the url when shareable.",
      "example_bad": "An affected change ignores this rule without review or documented exception."
    },
    {
      "title": "Protect restricted pages with UI guards while relying on server authorization",
      "detail": "Protect restricted pages with UI guards while relying on server authorization. Verification: inspect the relevant requirement, implementation or automated check; record evidence for compliance and explain justified deviations.",
      "layer": "process",
      "severity": "should",
      "example_good": "Implementation/review evidence explicitly demonstrates: protect restricted pages with ui guards while relying on server authorization.",
      "example_bad": "An affected change ignores this rule without review or documented exception."
    },
    {
      "title": "Handle deep reload and direct navigation with hosting fallback rules",
      "detail": "Handle deep reload and direct navigation with hosting fallback rules. Verification: inspect the relevant requirement, implementation or automated check; record evidence for compliance and explain justified deviations.",
      "layer": "process",
      "severity": "should",
      "example_good": "Implementation/review evidence explicitly demonstrates: handle deep reload and direct navigation with hosting fallback rules.",
      "example_bad": "An affected change ignores this rule without review or documented exception."
    }
  ],
  "integration_guide": [
    {
      "step": 1,
      "title": "Assess applicability",
      "description": "Check project platform, requirements, architecture and applicable conditions for Browser Routing & URL State; record exclusions and approved overrides."
    },
    {
      "step": 2,
      "title": "Apply rules",
      "description": "Include applicable Browser Routing & URL State rules in design, implementation and review checklist; link relevant requirement and code."
    },
    {
      "step": 3,
      "title": "Verify compliance",
      "description": "Review evidence, run relevant automated checks, record failures and follow-up work before completion."
    }
  ],
  "common_issues": [
    {
      "issue": "Inconsistent adoption of Browser Routing & URL State",
      "cause": "Project profile does not explicitly reference the standard or its owner.",
      "solution": "Attach standard by code to project profile, assign owner and check compliance before change approval."
    },
    {
      "issue": "Written standard is not enforceable automatically",
      "cause": "Some behaviour depends on design decisions and runtime context.",
      "solution": "Pair automated lint/tests with manual review and recorded acceptance evidence."
    }
  ],
  "depends_on": [
    {
      "code": "STD-REQ",
      "dependency_type": "requires"
    },
    {
      "code": "STD-TEST",
      "dependency_type": "requires"
    }
  ]
}
