{
  "schemaVersion": 1,
  "code": "STD-FL-DI",
  "name": "Flutter Dependency Injection",
  "category": "flutter",
  "description": "Lifecycle-safe Flutter dependencies",
  "version": "1.0.0",
  "status": "active",
  "rules": [
    {
      "title": "Register dependencies in a composition root",
      "detail": "Register dependencies in a composition root. Verification: inspect the relevant requirement, implementation or automated check; record evidence for compliance and explain justified deviations.",
      "layer": "process",
      "severity": "must",
      "example_good": "Implementation/review evidence explicitly demonstrates: register dependencies in a composition root.",
      "example_bad": "An affected change ignores this rule without review or documented exception."
    },
    {
      "title": "Use correct application, feature and transient lifetimes",
      "detail": "Use correct application, feature and transient lifetimes. Verification: inspect the relevant requirement, implementation or automated check; record evidence for compliance and explain justified deviations.",
      "layer": "process",
      "severity": "must",
      "example_good": "Implementation/review evidence explicitly demonstrates: use correct application, feature and transient lifetimes.",
      "example_bad": "An affected change ignores this rule without review or documented exception."
    },
    {
      "title": "Avoid service locator calls inside arbitrary widgets",
      "detail": "Avoid service locator calls inside arbitrary widgets. Verification: inspect the relevant requirement, implementation or automated check; record evidence for compliance and explain justified deviations.",
      "layer": "process",
      "severity": "should",
      "example_good": "Implementation/review evidence explicitly demonstrates: avoid service locator calls inside arbitrary widgets.",
      "example_bad": "An affected change ignores this rule without review or documented exception."
    },
    {
      "title": "Replace network/storage dependencies with fakes in tests",
      "detail": "Replace network/storage dependencies with fakes in tests. Verification: inspect the relevant requirement, implementation or automated check; record evidence for compliance and explain justified deviations.",
      "layer": "process",
      "severity": "should",
      "example_good": "Implementation/review evidence explicitly demonstrates: replace network/storage dependencies with fakes in tests.",
      "example_bad": "An affected change ignores this rule without review or documented exception."
    }
  ],
  "integration_guide": [
    {
      "step": 1,
      "title": "Assess applicability",
      "description": "Check project platform, requirements, architecture and applicable conditions for Flutter Dependency Injection; record exclusions and approved overrides."
    },
    {
      "step": 2,
      "title": "Apply rules",
      "description": "Include applicable Flutter Dependency Injection rules in design, implementation and review checklist; link relevant requirement and code."
    },
    {
      "step": 3,
      "title": "Verify compliance",
      "description": "Review evidence, run relevant automated checks, record failures and follow-up work before completion."
    }
  ],
  "common_issues": [
    {
      "issue": "Inconsistent adoption of Flutter Dependency Injection",
      "cause": "Project profile does not explicitly reference the standard or its owner.",
      "solution": "Attach standard by code to project profile, assign owner and check compliance before change approval."
    },
    {
      "issue": "Written standard is not enforceable automatically",
      "cause": "Some behaviour depends on design decisions and runtime context.",
      "solution": "Pair automated lint/tests with manual review and recorded acceptance evidence."
    }
  ],
  "depends_on": [
    {
      "code": "STD-REQ",
      "dependency_type": "requires"
    },
    {
      "code": "STD-TEST",
      "dependency_type": "requires"
    },
    {
      "code": "STD-MOB-ARCH",
      "dependency_type": "requires"
    }
  ]
}
