{
  "schemaVersion": 1,
  "code": "STD-RECOVER",
  "name": "Forgot & Reset Password Feature",
  "category": "feature",
  "description": "Safe credential recovery",
  "version": "1.0.0",
  "status": "active",
  "rules": [
    {
      "title": "Use single-use time-limited reset challenges",
      "detail": "Use single-use time-limited reset challenges. Verification: inspect the relevant requirement, implementation or automated check; record evidence for compliance and explain justified deviations.",
      "layer": "process",
      "severity": "must",
      "example_good": "Implementation/review evidence explicitly demonstrates: use single-use time-limited reset challenges.",
      "example_bad": "An affected change ignores this rule without review or documented exception."
    },
    {
      "title": "Provide generic responses that do not reveal account existence",
      "detail": "Provide generic responses that do not reveal account existence. Verification: inspect the relevant requirement, implementation or automated check; record evidence for compliance and explain justified deviations.",
      "layer": "process",
      "severity": "must",
      "example_good": "Implementation/review evidence explicitly demonstrates: provide generic responses that do not reveal account existence.",
      "example_bad": "An affected change ignores this rule without review or documented exception."
    },
    {
      "title": "Invalidate reset tokens after success and enforce password policy",
      "detail": "Invalidate reset tokens after success and enforce password policy. Verification: inspect the relevant requirement, implementation or automated check; record evidence for compliance and explain justified deviations.",
      "layer": "process",
      "severity": "should",
      "example_good": "Implementation/review evidence explicitly demonstrates: invalidate reset tokens after success and enforce password policy.",
      "example_bad": "An affected change ignores this rule without review or documented exception."
    },
    {
      "title": "Audit recovery events and test expired, reused or tampered links",
      "detail": "Audit recovery events and test expired, reused or tampered links. Verification: inspect the relevant requirement, implementation or automated check; record evidence for compliance and explain justified deviations.",
      "layer": "process",
      "severity": "should",
      "example_good": "Implementation/review evidence explicitly demonstrates: audit recovery events and test expired, reused or tampered links.",
      "example_bad": "An affected change ignores this rule without review or documented exception."
    }
  ],
  "integration_guide": [
    {
      "step": 1,
      "title": "Assess applicability",
      "description": "Check project platform, requirements, architecture and applicable conditions for Forgot & Reset Password Feature; record exclusions and approved overrides."
    },
    {
      "step": 2,
      "title": "Apply rules",
      "description": "Include applicable Forgot & Reset Password Feature rules in design, implementation and review checklist; link relevant requirement and code."
    },
    {
      "step": 3,
      "title": "Verify compliance",
      "description": "Review evidence, run relevant automated checks, record failures and follow-up work before completion."
    }
  ],
  "common_issues": [
    {
      "issue": "Inconsistent adoption of Forgot & Reset Password Feature",
      "cause": "Project profile does not explicitly reference the standard or its owner.",
      "solution": "Attach standard by code to project profile, assign owner and check compliance before change approval."
    },
    {
      "issue": "Written standard is not enforceable automatically",
      "cause": "Some behaviour depends on design decisions and runtime context.",
      "solution": "Pair automated lint/tests with manual review and recorded acceptance evidence."
    }
  ],
  "features": [
    {
      "name": "Forgot & Reset Password Feature",
      "description": "Safe credential recovery"
    }
  ],
  "user_stories": [
    {
      "title": "Use Forgot & Reset Password Feature",
      "as_a": "authorized application user",
      "i_want": "safe credential recovery",
      "so_that": "I can complete the intended task safely and predictably",
      "acceptance_criteria": [
        {
          "given": "the user is eligible to access Forgot & Reset Password Feature",
          "when": "the user performs the main supported action",
          "then": "the system returns an authorized, validated outcome and communicates its state"
        },
        {
          "given": "an input, permission or dependency is invalid",
          "when": "the user attempts the action",
          "then": "the system blocks unsafe completion and shows a recoverable, non-sensitive error"
        }
      ],
      "related_rules": [
        "Use single-use time-limited reset challenges"
      ]
    }
  ],
  "depends_on": [
    {
      "code": "STD-REQ",
      "dependency_type": "requires"
    },
    {
      "code": "STD-TEST",
      "dependency_type": "requires"
    },
    {
      "code": "STD-FEAT",
      "dependency_type": "requires"
    },
    {
      "code": "STD-BIZ",
      "dependency_type": "requires"
    }
  ]
}
